<?xml version="1.0" encoding="UTF-8"?>
<!ELEMENT ENTER_NAME_OF_ROOT_ELEMENT_HERE EMPTY>
<!ELEMENT DOCUMENT (CUSTOMER)*>
<!ELEMENT CUSTOMER (NAME,DATE,ORDERS)>
<!ELEMENT NAME (LAST_NAME,FIRST_NAME)>
<!ELEMENT LAST_NAME (#PCDATA)>
<!ELEMENT FIRST_NAME (#PCDATA)>
<!ELEMENT DATE (#PCDATA)>
<!ELEMENT ORDERS (ITEM)*>
<!ELEMENT ITEM (PRODUCT,NUMBER,PRICE)>
<!ELEMENT PRODUCT (#PCDATA)>
<!ELEMENT NUMBER (#PCDATA)>
<!ELEMENT PRICE (#PCDATA)>
